### ISSUE TITLE
Not able to connect to Panorama using bootstrap

### ISSUE THREAD

**Issue by BenSeb** [PaloAltoNetworks/terraform-azurerm-vmseries-modules#152]
## Describe the bug

When I deploy transit_vnet_common with bootstrap the firewalls will not connect to Panorama. I have tried panos versions 9.1, 10.0 and 10.1. 

## Expected behavior

The firewalls should connect to Panorama automatically.

## Current behavior

The firewalls will not connect to Panorama after deployment of transit_vnet_common. In Panorama I see the following in the logs: **Vm-auth-key <key> successfully authenticated for bootstrapped device <serial number>**

The firewall is therefore able to reach Panorama, but will not connect. The most recent versions on Panorama is 10.1.4-h4 and the firewall is 10.0.9. The following versions of the plugins:

**Plugin Azure - azure-3.1.0 (Panorama)
Plugin VM-Series - vm_series-2.1.4**

When deploying without bootstrap, I am able to manually connect to Panorama.

The initcfg.txt file:

type=dhcp-client
hostname=DE-AZ-LAB-COMMON
vm-auth-key=<key>
panorama-server=10.0.0.4
tplname=tpl_AutoScaling
dgname=dg_AutoScaling
dns-primary=1.1.1.1
dhcp-accept-server-hostname=yes
dhcp-accept-server-domain=yes

I went in to ms.log and noticed the following, but it does not make sense that this has something to do with this issue:

2022-04-26 01:28:26.395 -0700 panorama agent: channel teardown. sock=54 idx=0
2022-04-26 01:28:26.396 -0700 panorama agent: channel teardown complete. idx=0
2022-04-26 01:28:49.155 -0700 COMM: connection established. sock=54 remote ip=10.0.0.4 port=3978 local port=47714
2022-04-26 01:28:49.155 -0700 cms agent: Pre. send buffer limit=46080. s=54
2022-04-26 01:28:49.155 -0700 cms agent: Post. send buffer limit=2097152. s=54
2022-04-26 01:28:49.155 -0700 Error:  cs_load_certs_ex(cs_common.c:655): keyfile not exists
2022-04-26 01:28:49.155 -0700 Error:  pan_cmsa_tcp_channel_setup(src_panos/cms_agent.c:889): cms agent: cs_load_certs_ex failed
2022-04-26 01:28:49.160 -0700 panorama agent: ssl channel established. sock=54 ssl=0x55abb8d4bd40
2022-04-26 01:28:49.165 -0700 Error:  pan_get_content_release_date_by_sysd(pan_ops_content.c:1443): Failed to fetch from sysd for GPclient
2022-04-26 01:28:49.165 -0700 Error:  pan_get_content_release_date_by_sysd(pan_ops_content.c:1443): Failed to fetch from sysd for IoT
2022-04-26 01:28:49.165 -0700 Error:  pan_get_content_release_date_by_sysd(pan_ops_content.c:1443): Failed to fetch from sysd for Content
2022-04-26 01:28:49.165 -0700 Error:  pan_get_content_release_date_by_sysd(pan_ops_content.c:1443): Failed to fetch from sysd for Antivirus
2022-04-26 01:28:49.165 -0700 Error:  pan_get_content_release_date_by_sysd(pan_ops_content.c:1443): Failed to fetch from sysd for WildFire
2022-04-26 01:28:49.166 -0700 Error:  pan_get_content_release_date_by_sysd(pan_ops_content.c:1443): Failed to fetch from sysd for Content
2022-04-26 01:28:49.394 -0700 Error:  pan_mgmtop_get_system_info(pan_ops_common.c:16865): Unable to fetch net.s1.eth0.dhcp-dns: NO_MATCHES
2022-04-26 01:28:49.400 -0700 template config file /opt/pancfg/mgmt/template/template-config.xml doesn't exist
2022-04-26 01:28:49.400 -0700 Could not find last pushed template, returning empty template config tree
2022-04-26 01:28:49.400 -0700 Error:  pan_get_dgtplver_from_file_fw(pan_cfg_dg_tpl_utils.c:5773): Could not open file to obtain the jobid
2022-04-26 01:28:49.400 -0700 file /opt/pancfg/mgmt/template/pretrans-template-config.xml does not exist, not computing md5sum
2022-04-26 01:28:49.514 -0700 Error:  pan_cfg_mgr_get_device_cert_details(pan_cfg_mgr.c:10911): Error getting dev cert validity status from sysd node
2022-04-26 01:28:49.591 -0700 cms agent: registration request sent. len=54267 sock=54 idx=0
2022-04-26 01:28:50.348 -0700 error in response: tpl-exist
2022-04-26 01:29:20.264 -0700 Error:  pan_conn_entry_write_lock_ex_timeout(cs_conn.c:4575): connmgr: ex_timeout: get conn lock failed. result=-1.
2022-04-26 01:29:20.265 -0700 Error:  pan_cmsa_tcp_channel_loop(src_panos/cms_agent.c:1786): cmsa: cannot send probe. failed to lock. sock=54 ssl=0x55abb8d4bd40
2022-04-26 01:29:20.265 -0700 Drain thread type=1 total=0 match=0

Connection to Update server: updates.paloaltonetworks.com completed successfully, initiated by 10.11.255.4
2022-04-26 01:30:00.652 -0700 Checking to purge appstatdb logtype 

## Your Environment

OS: Ubuntu 20.04.1
Terraform v1.1.9 on linux_amd64

**Comment by ntwrkguru** [comment]
This is likely related to the fact that Panorama 10.1+ now requires the "device registration auth key" to be added to the firewall. [LINK](https://docs.paloaltonetworks.com/panorama/10-1/panorama-admin/manage-firewalls/add-a-firewall-as-a-managed-device). I don't think this is account for in the current modules.

**Comment by ntwrkguru** [comment]
Interesting...good feedback.

**Comment by devsecfranklin** [comment]
Just to be extra clear, I see the vm series auth key is blanked out in your initcfg. You had this field populated during your testing, correct? (Assume so due to connection attempt)

Can you please try again with DNS set to `168.63.129.16` (not knowing much about your peering/UDR situation, guessing you can't hit `1.1.1.1` cloud flare without NSG updates)

Please paste firewall output from `show system bootstrap status` and also `tcpdump filter “host 1.1.1.1”` and `tcpdump filter “host 168.63.129.16”`

**Comment by BenSeb** [comment]
Yeah, sorry. I had it populated when I tested it and blanked it out. 

It can hit cloudflare, and really anything, because I don't have any NSGs configured and it will use the default. In any case, I can try to change it to 168.63.129.16. Thanks!

show system bootstrap status

`show system bootstrap status`:
panadmin@AZ-LAB-COMMON> show system bootstrap status 

Bootstrap Phase               Status         Details
===============               ======         =======
Media Detection               Success        Media detected successfully
Media Sanity Check            Success        Media sanity check successful
Parsing of Initial Config     Successful     
License Install               Successful     Early licensing completed
License Install               Successful     Successfully installed license key for file /opt/pancfg/mgmt/bootstrap/Advanced_URL_Filtering_2022_04_26.key
License Install               Successful     Successfully installed license key for file /opt/pancfg/mgmt/bootstrap/DLP_.key
License Install               Successful     Successfully installed license key for file /opt/pancfg/mgmt/bootstrap/DNS_Security_2022_04_26.key
License Install               Successful     Successfully installed license key for file /opt/pancfg/mgmt/bootstrap/GlobalProtect_Gateway_2022_04_26.key
License Install               Successful     Successfully installed license key for file /opt/pancfg/mgmt/bootstrap Logging_Service_2022_04_26.key
License Install               Successful     Successfully installed license key for file /opt/pancfg/mgmt/bootstrap/PAN_DB_URL_Filtering_2022_04_26.key
License Install               Successful     Successfully installed license key for file /opt/pancfg/mgmt/bootstrap/PA_VM_.key
License Install               Successful     Successfully installed license key for file /opt/pancfg/mgmt/bootstrap/Standard.key
License Install               Successful     Successfully installed license key for file /opt/pancfg/mgmt/bootstrap/Threat_Prevention_2022_04_26.key
License Install               Successful     Successfully installed license key for file /opt/pancfg/mgmt/bootstrap/WildFire_License_2022_04_26.key
License Install               Successful     Successfully installed license key using authcode \<authcode\>

`tcpdump filter “host 1.1.1.1”`:

20:23:28.925041 IP 10.11.255.4.34609 > one.one.one.one.domain: 59180+ 
20:23:28.925117 IP 10.11.255.4.34609 > one.one.one.one.domain: 60759+ 
20:23:28.942593 IP one.one.one.one.domain > 10.11.255.4.34609: 59180 
20:23:28.944371 IP one.one.one.one.domain > 10.11.255.4.34609: 60759 


`tcpdump filter “host 168.63.129.16”`:

20:11:42.742841 IP 10.11.255.4.42370 > 168.63.129.16.http: Flags [S], seq 1570026541, win 29200, options [mss 1460,sackOK,TS val 35935129 ecr 0,nop,wscale 7], length 0
20:11:42.743417 IP 168.63.129.16.http > 10.11.255.4.42370: Flags [S.], seq 1823302617, ack 1570026542, win 8192, options [mss 1460,nop,wscale 8,sackOK,TS val 4094947398 ecr 35935129], length 0
20:11:42.743475 IP 10.11.255.4.42370 > 168.63.129.16.http: Flags [.], ack 1, win 229, options [nop,nop,TS val 35935130 ecr 4094947398], length 0
20:11:42.743513 IP 10.11.255.4.42370 > 168.63.129.16.http: Flags [P.], seq 1:199, ack 1, win 229, options [nop,nop,TS val 35935130 ecr 4094947398], length 198

**Comment by migara** [comment]
@BenSeb Are you still running into this issue?

**Comment by migara** [comment]
Please reopen if you can reproduce the issue.
